{
  "$schema": "../schemas/relaymark-directive.schema.json",
  "name": "Callout",
  "ast_type": "relay.callout",
  "category": "relay_kit",
  "description": "A styled document callout with an optional editable title and nested body blocks.",
  "attributes": {
    "tone": {
      "type": "enum",
      "values": ["neutral", "primary", "secondary", "accent", "info", "success", "warning", "error"],
      "required": true,
      "default": "neutral"
    },
    "emphasis": {
      "type": "enum",
      "values": ["soft", "strong"],
      "required": true,
      "default": "soft"
    },
    "title": {
      "type": "string",
      "description": "Plain-source title. The AST stores this as a first child so rich title marks retain identity."
    }
  },
  "children": { "mode": "block", "min": 1 },
  "validation": [
    "The optional relay.callout_title child is first and unique.",
    "At least one body block follows the title when present.",
    "Tone and emphasis use the exact declared values."
  ],
  "projections": { "html": "section[data-relay-callout]", "plain_text": "title and body text" },
  "policy": { "requires_review": false, "requires_evidence": false, "allows_agent_creation": true }
}
