{
  "$schema": "../schemas/relaymark-directive.schema.json",
  "name": "CalloutTitle",
  "ast_type": "relay.callout_title",
  "category": "relay_kit",
  "description": "An editable callout title with its own stable block identity and inline marks.",
  "attributes": {},
  "children": { "mode": "inline" },
  "validation": ["Only a first child of relay.callout, never a standalone block."],
  "projections": { "html": "p[data-callout-title]", "plain_text": "title text" },
  "policy": { "requires_review": false, "requires_evidence": false, "allows_agent_creation": true }
}
